title,description,image,github,play
Nebula Rush,A 2D arcade space shooter built in Unity,/images/project-nebula.svg,https://github.com/example/nebula-rush,https://example.com/nebula-rush
KhetiCraft,A cozy farming sim prototype with procedural weather,/images/project-kheti.svg,https://github.com/example/kheticraft,https://example.com/kheticraft
Astra Runner,Fast-paced endless runner with shader-heavy visuals,/images/project-astra.svg,https://github.com/example/astra-runner,https://example.com/astra-runner
Pixel Tactics,Turn-based strategy game made during game jam,/images/project-pixel.svg,https://github.com/example/pixel-tactics,https://example.com/pixel-tactics
Cell - o,An inter IIT winning game,,,/play/games/cello/index.html
